{
  "$schema": "https://json-schema.org/draft/2020-12/schema",
  "$id": "https://github.com/MWBMPartners/MeedyaSuite-core/docs/standards/data/bcp47-language-data-v1.schema.json",
  "title": "MWBM-MEDIA-LANG reference data, version 1",
  "description": "Registry-derived data every implementation of the Media Language & BCP 47 Policy reads, so the Rust, PHP and Swift versions agree exactly on replacements and old three-letter codes. Generated by scripts/media-lang/generate_language_data.py — never edit by hand.",
  "$comment": "A registry refresh is a data_version bump. If it changes any answer in tests/fixtures/bcp47-language-policy-v1.json, the fixtures version must be bumped in the same change.",
  "type": "object",
  "additionalProperties": false,
  "required": ["policy", "policy_version", "data_version", "sources", "special_languages", "languages", "language_ranges", "extlangs", "scripts", "script_ranges", "regions", "region_ranges", "variants", "preferred", "deprecated_without_replacement", "grandfathered", "redundant_preferred", "iso639_2", "iso639_2_for_language"],
  "properties": {
    "$schema": { "type": "string", "description": "Relative path to this schema." },
    "policy": { "const": "MWBM-MEDIA-LANG", "description": "The policy this data serves." },
    "policy_version": { "type": "string", "pattern": "^[0-9]+\\.[0-9]+\\.[0-9]+$", "description": "Policy version the data was generated for." },
    "data_version": { "type": "string", "pattern": "^[0-9]+\\.[0-9]+\\.[0-9]+$", "description": "Version of this data file." },
    "sources": {
      "type": "object", "additionalProperties": false, "required": ["iana_language_subtag_registry", "sil_iso_639_3"],
      "description": "Exactly which downloads the data was built from.",
      "properties": {
        "iana_language_subtag_registry": {
          "type": "object", "additionalProperties": false, "required": ["url", "file_date", "sha256"],
          "properties": {
            "url": { "type": "string", "format": "uri", "description": "Where the registry is published." },
            "file_date": { "type": "string", "format": "date", "description": "The registry's own File-Date line." },
            "sha256": { "type": "string", "pattern": "^[0-9a-f]{64}$", "description": "Checksum of the file used." }
          },
          "description": "The IANA Language Subtag Registry."
        },
        "sil_iso_639_3": {
          "type": "object", "additionalProperties": false, "required": ["url", "retrieved", "sha256"],
          "properties": {
            "url": { "type": "string", "format": "uri", "description": "Where the table is published." },
            "retrieved": { "type": "string", "format": "date", "description": "Date downloaded (the table has no date of its own)." },
            "sha256": { "type": "string", "pattern": "^[0-9a-f]{64}$", "description": "Checksum of the file used." }
          },
          "description": "The SIL ISO 639-3 code table (Part 2B / Part 2T / Part 1 columns)."
        }
      }
    },
    "special_languages": { "type": "object", "additionalProperties": { "type": "string" }, "description": "The four special-purpose codes (mul, mis, und, zxx) and what each means (LANG-003, LANG-025)." },
    "languages": { "type": "array", "items": { "type": "string", "pattern": "^[a-z]{2,8}$" }, "description": "Every registered primary language subtag, lower case, sorted. Ranges are listed separately." },
    "language_ranges": { "$ref": "#/$defs/ranges", "description": "Registered ranges of language subtags (qaa..qtz, local use)." },
    "extlangs": { "type": "object", "additionalProperties": { "type": "array", "items": { "type": "string" } }, "description": "Each registered extlang subtag and the primary language(s) it may follow." },
    "scripts": { "type": "array", "items": { "type": "string", "pattern": "^[A-Z][a-z]{3}$" }, "description": "Registered script subtags, title case." },
    "script_ranges": { "$ref": "#/$defs/ranges", "description": "Registered ranges of script subtags (private use)." },
    "regions": { "type": "array", "items": { "type": "string", "pattern": "^([A-Z]{2}|[0-9]{3})$" }, "description": "Registered region subtags: two-letter codes upper case, three-digit UN M.49 codes." },
    "region_ranges": { "$ref": "#/$defs/ranges", "description": "Registered ranges of region subtags (private use)." },
    "variants": { "type": "array", "items": { "type": "string" }, "description": "Registered variant subtags, lower case." },
    "preferred": {
      "type": "object", "additionalProperties": false, "required": ["language", "extlang", "script", "region", "variant"],
      "description": "Registry Preferred-Value replacements used by LANG-001 step 5, by subtag type.",
      "properties": {
        "language": { "$ref": "#/$defs/map", "description": "Deprecated language subtag -> replacement (iw -> he)." },
        "extlang": { "$ref": "#/$defs/map", "description": "Extlang -> the language that replaces language+extlang (yue -> yue)." },
        "script": { "$ref": "#/$defs/map", "description": "Deprecated script -> replacement." },
        "region": { "$ref": "#/$defs/map", "description": "Deprecated region -> replacement (DD -> DE)." },
        "variant": { "$ref": "#/$defs/map", "description": "Deprecated variant -> replacement (heploc -> alalc97)." }
      }
    },
    "deprecated_without_replacement": {
      "type": "object", "additionalProperties": { "type": "array", "items": { "type": "string" } },
      "description": "Deprecated subtags with no single replacement (for example CS, which split into two countries). Kept as written and reported, never guessed (LANG-001)."
    },
    "grandfathered": {
      "type": "object",
      "additionalProperties": {
        "type": "object", "additionalProperties": false, "required": ["tag", "preferred"],
        "properties": {
          "tag": { "type": "string", "description": "The tag as the registry spells it (its canonical case)." },
          "preferred": { "type": ["string", "null"], "description": "Replacement, or null if the registry gives none (then the tag is kept as is)." }
        }
      },
      "description": "Every grandfathered tag, keyed in lower case (LANG-001 step 2)."
    },
    "redundant_preferred": { "$ref": "#/$defs/map", "description": "Redundant tags (lower case) that have a replacement (sgn-br -> bzs), LANG-001 step 4." },
    "iso639_2": { "$ref": "#/$defs/map", "description": "Reading old fields (LANG-002): every ISO 639-2 code, B and T forms, plus four withdrawn codes -> canonical BCP 47 language subtag." },
    "iso639_2_for_language": {
      "type": "object",
      "additionalProperties": {
        "type": "object", "additionalProperties": false, "required": ["b", "t"],
        "properties": {
          "b": { "type": "string", "pattern": "^[a-z]{3}$", "description": "Bibliographic form — Matroska's old Language element (RFC 9559 §12)." },
          "t": { "type": "string", "pattern": "^[a-z]{3}$", "description": "Terminology form — MP4/MOV media header, and ID3." }
        }
      },
      "description": "Writing old fields (TRACK-070): BCP 47 language subtag -> its ISO 639-2 code in both forms. A language not listed has no ISO 639-2 code; write 'und'."
    }
  },
  "$defs": {
    "ranges": { "type": "array", "items": { "type": "array", "prefixItems": [{ "type": "string" }, { "type": "string" }], "minItems": 2, "maxItems": 2 }, "description": "Inclusive [first, last] ranges, compared as plain ASCII." },
    "map": { "type": "object", "additionalProperties": { "type": "string" }, "description": "String -> string lookup." }
  }
}
