{
 "$schema": "./bcp47-language-data-v1.schema.json",
 "data_version": "1.0.0",
 "deprecated_without_replacement": {
  "language": [
   "agp",
   "ais",
   "aoh",
   "ayy",
   "baz",
   "bbz",
   "bhk",
   "bij",
   "bjq",
   "bkb",
   "bmy",
   "bpb",
   "btb",
   "btl",
   "bxx",
   "byy",
   "cbe",
   "cbh",
   "cca",
   "cdg",
   "cug",
   "cum",
   "daf",
   "dap",
   "dgu",
   "dha",
   "djl",
   "dkl",
   "dud",
   "duj",
   "dwl",
   "ekc",
   "elp",
   "emo",
   "gbc",
   "ggo",
   "ggr",
   "gio",
   "gji",
   "iap",
   "ill",
   "ime",
   "izi",
   "jar",
   "kbf",
   "kdv",
   "kgd",
   "kjf",
   "kox",
   "kpp",
   "ksa",
   "kxu",
   "kzh",
   "lba",
   "leg",
   "lmz",
   "lno",
   "lsg",
   "mgx",
   "mhh",
   "mja",
   "mld",
   "mnt",
   "mof",
   "mvm",
   "mwd",
   "mwx",
   "mwy",
   "myi",
   "myq",
   "nbf",
   "nbx",
   "ngo",
   "nln",
   "nlr",
   "noo",
   "ome",
   "pbz",
   "pgy",
   "pii",
   "plj",
   "plp",
   "pod",
   "prb",
   "puk",
   "rie",
   "rmr",
   "rna",
   "rsi",
   "sap",
   "sdm",
   "sgl",
   "sgo",
   "slq",
   "snh",
   "sul",
   "sum",
   "svr",
   "tbb",
   "tgg",
   "tid",
   "toe",
   "unp",
   "uun",
   "vki",
   "wgw",
   "wit",
   "wiw",
   "wra",
   "wrd",
   "wya",
   "xbx",
   "xip",
   "xtz",
   "yds",
   "yen",
   "yiy",
   "ynh",
   "yri",
   "zua"
  ],
  "region": [
   "AN",
   "CS",
   "NT",
   "SU",
   "YU"
  ],
  "script": [],
  "variant": [
   "arevela",
   "arevmda",
   "laukika",
   "vaidika"
  ]
 },
 "extlangs": {
  "aao": [
   "ar"
  ],
  "abh": [
   "ar"
  ],
  "abv": [
   "ar"
  ],
  "acm": [
   "ar"
  ],
  "acq": [
   "ar"
  ],
  "acw": [
   "ar"
  ],
  "acx": [
   "ar"
  ],
  "acy": [
   "ar"
  ],
  "adf": [
   "ar"
  ],
  "ads": [
   "sgn"
  ],
  "aeb": [
   "ar"
  ],
  "aec": [
   "ar"
  ],
  "aed": [
   "sgn"
  ],
  "aen": [
   "sgn"
  ],
  "afb": [
   "ar"
  ],
  "afg": [
   "sgn"
  ],
  "ajp": [
   "ar"
  ],
  "ajs": [
   "sgn"
  ],
  "apc": [
   "ar"
  ],
  "apd": [
   "ar"
  ],
  "arb": [
   "ar"
  ],
  "arq": [
   "ar"
  ],
  "ars": [
   "ar"
  ],
  "ary": [
   "ar"
  ],
  "arz": [
   "ar"
  ],
  "ase": [
   "sgn"
  ],
  "asf": [
   "sgn"
  ],
  "asp": [
   "sgn"
  ],
  "asq": [
   "sgn"
  ],
  "asw": [
   "sgn"
  ],
  "auz": [
   "ar"
  ],
  "avl": [
   "ar"
  ],
  "ayh": [
   "ar"
  ],
  "ayl": [
   "ar"
  ],
  "ayn": [
   "ar"
  ],
  "ayp": [
   "ar"
  ],
  "bbz": [
   "ar"
  ],
  "bfi": [
   "sgn"
  ],
  "bfk": [
   "sgn"
  ],
  "bjn": [
   "ms"
  ],
  "bog": [
   "sgn"
  ],
  "bqn": [
   "sgn"
  ],
  "bqy": [
   "sgn"
  ],
  "btj": [
   "ms"
  ],
  "bve": [
   "ms"
  ],
  "bvl": [
   "sgn"
  ],
  "bvu": [
   "ms"
  ],
  "bzs": [
   "sgn"
  ],
  "cdo": [
   "zh"
  ],
  "cds": [
   "sgn"
  ],
  "cjy": [
   "zh"
  ],
  "cmn": [
   "zh"
  ],
  "cnp": [
   "zh"
  ],
  "coa": [
   "ms"
  ],
  "cpx": [
   "zh"
  ],
  "csc": [
   "sgn"
  ],
  "csd": [
   "sgn"
  ],
  "cse": [
   "sgn"
  ],
  "csf": [
   "sgn"
  ],
  "csg": [
   "sgn"
  ],
  "csl": [
   "sgn"
  ],
  "csn": [
   "sgn"
  ],
  "csp": [
   "zh"
  ],
  "csq": [
   "sgn"
  ],
  "csr": [
   "sgn"
  ],
  "csx": [
   "sgn"
  ],
  "czh": [
   "zh"
  ],
  "czo": [
   "zh"
  ],
  "doq": [
   "sgn"
  ],
  "dse": [
   "sgn"
  ],
  "dsl": [
   "sgn"
  ],
  "dsz": [
   "sgn"
  ],
  "dup": [
   "ms"
  ],
  "dyl": [
   "sgn"
  ],
  "ecs": [
   "sgn"
  ],
  "ehs": [
   "sgn"
  ],
  "esl": [
   "sgn"
  ],
  "esn": [
   "sgn"
  ],
  "eso": [
   "sgn"
  ],
  "eth": [
   "sgn"
  ],
  "fcs": [
   "sgn"
  ],
  "fse": [
   "sgn"
  ],
  "fsl": [
   "sgn"
  ],
  "fss": [
   "sgn"
  ],
  "gan": [
   "zh"
  ],
  "gds": [
   "sgn"
  ],
  "gom": [
   "kok"
  ],
  "gse": [
   "sgn"
  ],
  "gsg": [
   "sgn"
  ],
  "gsm": [
   "sgn"
  ],
  "gss": [
   "sgn"
  ],
  "gus": [
   "sgn"
  ],
  "hab": [
   "sgn"
  ],
  "haf": [
   "sgn"
  ],
  "hak": [
   "zh"
  ],
  "hds": [
   "sgn"
  ],
  "hji": [
   "ms"
  ],
  "hks": [
   "sgn"
  ],
  "hnm": [
   "zh"
  ],
  "hos": [
   "sgn"
  ],
  "hps": [
   "sgn"
  ],
  "hsh": [
   "sgn"
  ],
  "hsl": [
   "sgn"
  ],
  "hsn": [
   "zh"
  ],
  "icl": [
   "sgn"
  ],
  "iks": [
   "sgn"
  ],
  "ils": [
   "sgn"
  ],
  "inl": [
   "sgn"
  ],
  "ins": [
   "sgn"
  ],
  "ise": [
   "sgn"
  ],
  "isg": [
   "sgn"
  ],
  "isr": [
   "sgn"
  ],
  "jak": [
   "ms"
  ],
  "jax": [
   "ms"
  ],
  "jcs": [
   "sgn"
  ],
  "jhs": [
   "sgn"
  ],
  "jks": [
   "sgn"
  ],
  "jls": [
   "sgn"
  ],
  "jos": [
   "sgn"
  ],
  "jsl": [
   "sgn"
  ],
  "jus": [
   "sgn"
  ],
  "kgi": [
   "sgn"
  ],
  "knn": [
   "kok"
  ],
  "kvb": [
   "ms"
  ],
  "kvk": [
   "sgn"
  ],
  "kvr": [
   "ms"
  ],
  "kxd": [
   "ms"
  ],
  "lbs": [
   "sgn"
  ],
  "lce": [
   "ms"
  ],
  "lcf": [
   "ms"
  ],
  "lgs": [
   "sgn"
  ],
  "liw": [
   "ms"
  ],
  "lls": [
   "sgn"
  ],
  "lsb": [
   "sgn"
  ],
  "lsc": [
   "sgn"
  ],
  "lsg": [
   "sgn"
  ],
  "lsl": [
   "sgn"
  ],
  "lsn": [
   "sgn"
  ],
  "lso": [
   "sgn"
  ],
  "lsp": [
   "sgn"
  ],
  "lst": [
   "sgn"
  ],
  "lsv": [
   "sgn"
  ],
  "lsw": [
   "sgn"
  ],
  "lsy": [
   "sgn"
  ],
  "ltg": [
   "lv"
  ],
  "luh": [
   "zh"
  ],
  "lvs": [
   "lv"
  ],
  "lws": [
   "sgn"
  ],
  "lzh": [
   "zh"
  ],
  "max": [
   "ms"
  ],
  "mdl": [
   "sgn"
  ],
  "meo": [
   "ms"
  ],
  "mfa": [
   "ms"
  ],
  "mfb": [
   "ms"
  ],
  "mfs": [
   "sgn"
  ],
  "min": [
   "ms"
  ],
  "mnp": [
   "zh"
  ],
  "mqg": [
   "ms"
  ],
  "mre": [
   "sgn"
  ],
  "msd": [
   "sgn"
  ],
  "msi": [
   "ms"
  ],
  "msr": [
   "sgn"
  ],
  "mui": [
   "ms"
  ],
  "mzc": [
   "sgn"
  ],
  "mzg": [
   "sgn"
  ],
  "mzy": [
   "sgn"
  ],
  "nan": [
   "zh"
  ],
  "nbs": [
   "sgn"
  ],
  "ncs": [
   "sgn"
  ],
  "nsi": [
   "sgn"
  ],
  "nsl": [
   "sgn"
  ],
  "nsp": [
   "sgn"
  ],
  "nsr": [
   "sgn"
  ],
  "nzs": [
   "sgn"
  ],
  "okl": [
   "sgn"
  ],
  "orn": [
   "ms"
  ],
  "ors": [
   "ms"
  ],
  "pel": [
   "ms"
  ],
  "pga": [
   "ar"
  ],
  "pgz": [
   "sgn"
  ],
  "pks": [
   "sgn"
  ],
  "prl": [
   "sgn"
  ],
  "prz": [
   "sgn"
  ],
  "psc": [
   "sgn"
  ],
  "psd": [
   "sgn"
  ],
  "pse": [
   "ms"
  ],
  "psg": [
   "sgn"
  ],
  "psl": [
   "sgn"
  ],
  "pso": [
   "sgn"
  ],
  "psp": [
   "sgn"
  ],
  "psr": [
   "sgn"
  ],
  "pys": [
   "sgn"
  ],
  "rib": [
   "sgn"
  ],
  "rms": [
   "sgn"
  ],
  "rnb": [
   "sgn"
  ],
  "rsi": [
   "sgn"
  ],
  "rsl": [
   "sgn"
  ],
  "rsm": [
   "sgn"
  ],
  "rsn": [
   "sgn"
  ],
  "sdl": [
   "sgn"
  ],
  "sfb": [
   "sgn"
  ],
  "sfs": [
   "sgn"
  ],
  "sgg": [
   "sgn"
  ],
  "sgx": [
   "sgn"
  ],
  "shu": [
   "ar"
  ],
  "sjc": [
   "zh"
  ],
  "slf": [
   "sgn"
  ],
  "sls": [
   "sgn"
  ],
  "sqk": [
   "sgn"
  ],
  "sqs": [
   "sgn"
  ],
  "sqx": [
   "sgn"
  ],
  "ssh": [
   "ar"
  ],
  "ssp": [
   "sgn"
  ],
  "ssr": [
   "sgn"
  ],
  "svk": [
   "sgn"
  ],
  "swc": [
   "sw"
  ],
  "swh": [
   "sw"
  ],
  "swl": [
   "sgn"
  ],
  "syy": [
   "sgn"
  ],
  "szs": [
   "sgn"
  ],
  "tmw": [
   "ms"
  ],
  "tse": [
   "sgn"
  ],
  "tsm": [
   "sgn"
  ],
  "tsq": [
   "sgn"
  ],
  "tss": [
   "sgn"
  ],
  "tsy": [
   "sgn"
  ],
  "tza": [
   "sgn"
  ],
  "ugn": [
   "sgn"
  ],
  "ugy": [
   "sgn"
  ],
  "ukl": [
   "sgn"
  ],
  "uks": [
   "sgn"
  ],
  "urk": [
   "ms"
  ],
  "uzn": [
   "uz"
  ],
  "uzs": [
   "uz"
  ],
  "vgt": [
   "sgn"
  ],
  "vkk": [
   "ms"
  ],
  "vkt": [
   "ms"
  ],
  "vsi": [
   "sgn"
  ],
  "vsl": [
   "sgn"
  ],
  "vsv": [
   "sgn"
  ],
  "wbs": [
   "sgn"
  ],
  "wuu": [
   "zh"
  ],
  "xki": [
   "sgn"
  ],
  "xml": [
   "sgn"
  ],
  "xmm": [
   "ms"
  ],
  "xms": [
   "sgn"
  ],
  "yds": [
   "sgn"
  ],
  "ygs": [
   "sgn"
  ],
  "yhs": [
   "sgn"
  ],
  "ysl": [
   "sgn"
  ],
  "ysm": [
   "sgn"
  ],
  "yue": [
   "zh"
  ],
  "zhk": [
   "sgn"
  ],
  "zib": [
   "sgn"
  ],
  "zlm": [
   "ms"
  ],
  "zmi": [
   "ms"
  ],
  "zsl": [
   "sgn"
  ],
  "zsm": [
   "ms"
  ]
 },
 "grandfathered": {
  "art-lojban": {
   "preferred": "jbo",
   "tag": "art-lojban"
  },
  "cel-gaulish": {
   "preferred": null,
   "tag": "cel-gaulish"
  },
  "en-gb-oed": {
   "preferred": "en-GB-oxendict",
   "tag": "en-GB-oed"
  },
  "i-ami": {
   "preferred": "ami",
   "tag": "i-ami"
  },
  "i-bnn": {
   "preferred": "bnn",
   "tag": "i-bnn"
  },
  "i-default": {
   "preferred": null,
   "tag": "i-default"
  },
  "i-enochian": {
   "preferred": null,
   "tag": "i-enochian"
  },
  "i-hak": {
   "preferred": "hak",
   "tag": "i-hak"
  },
  "i-klingon": {
   "preferred": "tlh",
   "tag": "i-klingon"
  },
  "i-lux": {
   "preferred": "lb",
   "tag": "i-lux"
  },
  "i-mingo": {
   "preferred": null,
   "tag": "i-mingo"
  },
  "i-navajo": {
   "preferred": "nv",
   "tag": "i-navajo"
  },
  "i-pwn": {
   "preferred": "pwn",
   "tag": "i-pwn"
  },
  "i-tao": {
   "preferred": "tao",
   "tag": "i-tao"
  },
  "i-tay": {
   "preferred": "tay",
   "tag": "i-tay"
  },
  "i-tsu": {
   "preferred": "tsu",
   "tag": "i-tsu"
  },
  "no-bok": {
   "preferred": "nb",
   "tag": "no-bok"
  },
  "no-nyn": {
   "preferred": "nn",
   "tag": "no-nyn"
  },
  "sgn-be-fr": {
   "preferred": "sfb",
   "tag": "sgn-BE-FR"
  },
  "sgn-be-nl": {
   "preferred": "vgt",
   "tag": "sgn-BE-NL"
  },
  "sgn-ch-de": {
   "preferred": "sgg",
   "tag": "sgn-CH-DE"
  },
  "zh-guoyu": {
   "preferred": "cmn",
   "tag": "zh-guoyu"
  },
  "zh-hakka": {
   "preferred": "hak",
   "tag": "zh-hakka"
  },
  "zh-min": {
   "preferred": null,
   "tag": "zh-min"
  },
  "zh-min-nan": {
   "preferred": "nan",
   "tag": "zh-min-nan"
  },
  "zh-xiang": {
   "preferred": "hsn",
   "tag": "zh-xiang"
  }
 },
 "iso639_2": {
  "aar": "aa",
  "aav": "aav",
  "abk": "ab",
  "ace": "ace",
  "ach": "ach",
  "ada": "ada",
  "ady": "ady",
  "afa": "afa",
  "afh": "afh",
  "afr": "af",
  "ain": "ain",
  "aka": "ak",
  "akk": "akk",
  "alb": "sq",
  "ale": "ale",
  "alg": "alg",
  "alt": "alt",
  "alv": "alv",
  "amh": "am",
  "ang": "ang",
  "anp": "anp",
  "apa": "apa",
  "aqa": "aqa",
  "aql": "aql",
  "ara": "ar",
  "arc": "arc",
  "arg": "an",